{
  "$schema": "../schemas/capability-matrix.schema.json",
  "schema_version": "1.0.0",
  "updated_at": "2026-08-29T00:00:00Z",
  "repository_commit": "37805cb0e61cd4c46d7a3653c2ad8da212295a7a",
  "capabilities": [
    {
      "id": "app.swiftui_shell",
      "name": "Native SwiftUI application shell",
      "domain": "app",
      "implementation_state": "implemented",
      "runtime_state": "registered_ready",
      "user_path_state": "ui_reachable",
      "verification_state": "system_tested",
      "risk_tier": "observation",
      "owning_track": "R9",
      "production_files": [
        "Sources/AURA/AURA.swift",
        "Sources/AURA/AuraMenuView.swift",
        "Sources/AURA/AuraAppModel.swift"
      ],
      "test_files": [
        "Tests/AURAIntegrationTests"
      ],
      "dependencies": [],
      "open_gaps": [
        "No complete conversation window, text fallback, capability center, task center, model center, or memory center."
      ],
      "evidence_ids": [],
      "notes": "Operational shell, not yet a complete assistant UX."
    },
    {
      "id": "voice.push_to_talk",
      "name": "Push-to-Talk voice activation",
      "domain": "voice",
      "implementation_state": "implemented",
      "runtime_state": "registered_ready",
      "user_path_state": "voice_reachable",
      "verification_state": "system_tested",
      "risk_tier": "observation",
      "owning_track": "R7",
      "production_files": [
        "Sources/AURA/AuraAppModel.swift",
        "Sources/AURA/AuraKernel.swift",
        "Sources/AuraAudio",
        "Sources/AuraCore/VoiceResourceGovernor.swift"
      ],
      "test_files": [
        "Tests/AURAIntegrationTests",
        "Tests/AuraAudioTests"
      ],
      "dependencies": [
        "voice.stt_native",
        "voice.tts_system"
      ],
      "open_gaps": [
        "Live long-duration soak, external microphone/device-switch matrix, barge-in/echo recovery, and transcript UI."
      ],
      "evidence_ids": [
        "EV-R7-20260808-VOICE-LOCAL-SAFETY-01"
      ],
      "notes": "Primary supported production activation path; wake-word enablement is explicitly excluded until qualified."
    },
    {
      "id": "voice.wake_word",
      "name": "Real local wake-word activation",
      "domain": "voice",
      "implementation_state": "partial",
      "runtime_state": "registered_disabled",
      "user_path_state": "test_only",
      "verification_state": "unit_only",
      "risk_tier": "observation",
      "owning_track": "R7",
      "production_files": [
        "Sources/AuraAudio/WakeWordDetector.swift",
        "Sources/AuraAudio/WakeWordPipeline.swift"
      ],
      "test_files": [
        "Tests/AuraAudioTests"
      ],
      "dependencies": [
        "voice.audio_capture",
        "voice.vad"
      ],
      "open_gaps": [
        "No evaluated production acoustic model, Turkish support, license/hash, FAR/FRR, noise/distance, self-trigger, or soak evidence."
      ],
      "evidence_ids": [
        "EV-R7-20260808-VOICE-LOCAL-SAFETY-01",
        "EV-SP-015-20260822-WAKE-EXCLUSION-01"
      ],
      "notes": "DisabledWakeWordDetector is the truthful production path; MarkerWakeWordDetector is test-only. SP-015 (2026-08-22) explicitly EXCLUDES wake word from the release scope: no licensed local candidate is provisioned/bundled and download/install authority is absent; the UI truthfully states no acoustic model is installed and Push to Talk remains available. ADR-042 file is absent (Proposed)."
    },
    {
      "id": "voice.audio_capture",
      "name": "Local audio capture",
      "domain": "voice",
      "implementation_state": "implemented",
      "runtime_state": "registered_ready",
      "user_path_state": "voice_reachable",
      "verification_state": "system_tested",
      "risk_tier": "observation",
      "owning_track": "R7",
      "production_files": [
        "Sources/AuraAudio"
      ],
      "test_files": [
        "Tests/AuraAudioTests",
        "Tests/AURAIntegrationTests"
      ],
      "dependencies": [],
      "open_gaps": [
        "Release-hardware soak and sleep/wake/device-change recovery evidence."
      ],
      "evidence_ids": [],
      "notes": "Ambient retention must remain disabled by default."
    },
    {
      "id": "voice.vad",
      "name": "Voice activity detection",
      "domain": "voice",
      "implementation_state": "implemented",
      "runtime_state": "registered_ready",
      "user_path_state": "voice_reachable",
      "verification_state": "integration_simulated",
      "risk_tier": "observation",
      "owning_track": "R7",
      "production_files": [
        "Sources/AuraAudio"
      ],
      "test_files": [
        "Tests/AuraAudioTests",
        "Tests/AURAIntegrationTests"
      ],
      "dependencies": [
        "voice.audio_capture"
      ],
      "open_gaps": [
        "Adaptive calibration and real acoustic environment evaluation."
      ],
      "evidence_ids": [],
      "notes": "Energy-based implementation."
    },
    {
      "id": "voice.stt_native",
      "name": "Apple on-device Speech transcription",
      "domain": "voice",
      "implementation_state": "implemented",
      "runtime_state": "registered_ready",
      "user_path_state": "voice_reachable",
      "verification_state": "system_tested",
      "risk_tier": "observation",
      "owning_track": "R7",
      "production_files": [
        "Sources/AuraSTT/SystemSTTEngine.swift",
        "Sources/AuraSTT/STTRouter.swift",
        "Sources/AuraSTT/STTPipeline.swift"
      ],
      "test_files": [
        "Tests/AuraSTTTests",
        "Tests/AURAIntegrationTests"
      ],
      "dependencies": [
        "voice.audio_capture"
      ],
      "open_gaps": [
        "Live Turkish/English/mixed WER/entity evaluation, qualified local Whisper/equivalent fallback, microphone/TCC evidence, and live device recovery."
      ],
      "evidence_ids": [],
      "notes": "Ordered local locale fallback with capability checks; requires on-device recognition and does not silently rewrite a transcript on quality grounds."
    },
    {
      "id": "voice.tts_system",
      "name": "Apple system TTS fallback",
      "domain": "voice",
      "implementation_state": "implemented",
      "runtime_state": "registered_ready",
      "user_path_state": "voice_reachable",
      "verification_state": "system_tested",
      "risk_tier": "observation",
      "owning_track": "R7",
      "production_files": [
        "Sources/AuraAudio/SystemTTSEngine.swift"
      ],
      "test_files": [
        "Tests/AuraAudioTests"
      ],
      "dependencies": [],
      "open_gaps": [
        "Release-hardware latency and human quality evidence."
      ],
      "evidence_ids": [],
      "notes": "Premium neural Kaan is the safe local fallback."
    },
    {
      "id": "voice.tts_chatterbox",
      "name": "Chatterbox Multilingual V3 neural TTS",
      "domain": "voice",
      "implementation_state": "partial",
      "runtime_state": "registered_degraded",
      "user_path_state": "developer_only",
      "verification_state": "live_verified",
      "risk_tier": "observation",
      "owning_track": "R7",
      "production_files": [
        "Sources/AuraAudio/ChatterboxTTSEngine.swift",
        "Runtime/chatterbox/chatterbox_helper.py"
      ],
      "test_files": [
        "Tests/AuraAudioTests",
        "Runtime/chatterbox/tests"
      ],
      "dependencies": [
        "voice.tts_system"
      ],
      "open_gaps": [
        "MPS remains unqualified, CPU first-audio/latency and human quality evidence are open, and consented reference/hash/license/cache/soak gates remain."
      ],
      "evidence_ids": [
        "EV-R7-20260730-CHATTERBOX-CPU-01",
        "EV-R7-20260808-VOICE-LOCAL-SAFETY-01"
      ],
      "notes": "CPU is the safe default; helper timeout, resource admission, cleanup, and Kaan fallback must fail closed to system TTS when neural gates are unmet."
    },
    {
      "id": "dialogue.conversation",
      "name": "General multi-turn conversation",
      "domain": "dialogue",
      "implementation_state": "partial",
      "runtime_state": "registered_degraded",
      "user_path_state": "voice_reachable",
      "verification_state": "integration_simulated",
      "risk_tier": "observation",
      "owning_track": "R2",
      "production_files": [
        "Sources/AuraAgent/Conversation.swift",
        "Sources/AuraIntent/ToolRouter.swift"
      ],
      "test_files": [
        "Tests/AuraAgentTests",
        "Tests/AuraIntentTests"
      ],
      "dependencies": [
        "intent.classification",
        "model.ollama"
      ],
      "open_gaps": [
        "Open conversation returns a fixed acknowledgement; no model-backed dialogue or multi-turn slot state."
      ],
      "evidence_ids": [],
      "notes": "Conversation state machine exists; reasoning path does not."
    },
    {
      "id": "intent.classification",
      "name": "Natural-language intent classification",
      "domain": "intent",
      "implementation_state": "partial",
      "runtime_state": "registered_degraded",
      "user_path_state": "voice_reachable",
      "verification_state": "integration_simulated",
      "risk_tier": "observation",
      "owning_track": "R2",
      "production_files": [
        "Sources/AuraIntent/IntentEngine.swift",
        "Sources/AuraIntent/TypedIntent.swift"
      ],
      "test_files": [
        "Tests/AuraIntentTests"
      ],
      "dependencies": [],
      "open_gaps": [
        "English-only closed grammar, tiny application/executable dictionaries, no bilingual model-assisted schema."
      ],
      "evidence_ids": [],
      "notes": "Safe but too narrow for the intended product."
    },
    {
      "id": "model.ollama",
      "name": "Local Ollama model routing",
      "domain": "model",
      "implementation_state": "implemented",
      "runtime_state": "registered_ready",
      "user_path_state": "ui_reachable",
      "verification_state": "integration_simulated",